{
  "$schema": "./org-config.schema.json",

  "name": "Optimism Super Delegate",
  "schemaId": "0xe4a196f8ea37d5f9699b095594e44b465b2703eff0615cf9766060786eef517b",
  "authorizedAttestor": "0x93E79499b00a2fdAAC38e6005B0ad8E88b177346",

  "network": "optimism-mainnet",

  "color": "#ff0420",
  "startBlock": 
  121313963
}
